{
  "companyId": "telegram.org",
  "tagId": "russian-ties",
  "justification": "Migrated from original BehindTheSite data. Founded by Russian entrepreneurs, now based in UAE",
  "sources": [
    {
      "type": "other",
      "title": "Original BehindTheSite data (needs verification)",
      "date": "2026-02-01"
    }
  ],
  "status": "active",
  "voting": {
    "enabled": false,
    "upvotes": 0,
    "downvotes": 0
  },
  "author": {
    "github": "behindthesite-migration"
  },
  "created": "2026-02-02T04:07:53.216Z"
}